{
  "schema_version": 1,
  "id": "builtin.layout.circle-rings-8",
  "revision": 1,
  "name": "Concentric Arena Rings",
  "category": "basic",
  "editor": { "mode": "form" },
  "geometry": {
    "shape": "circle",
    "rings": 8,
    "increment": 18,
    "fixture_size": { "width": 10, "height": 10 },
    "ring_gap": 20,
    "ring_pitch": 30,
    "center": { "x": 0, "y": 0 }
  }
}
