{
  "schema_version": 1,
  "id": "builtin.layout.strip-runway-30",
  "revision": 1,
  "name": "Runway Strip 30",
  "category": "basic",
  "editor": { "mode": "form" },
  "geometry": {
    "shape": "strip",
    "count": 30,
    "orientation": "horizontal",
    "fixture_size": { "width": 8, "height": 14 },
    "gap": { "x": 4, "y": 6 },
    "pitch": { "x": 12, "y": 20 },
    "origin": { "x": 0, "y": 0 }
  }
}
