{
  "schema_version": 1,
  "id": "builtin.layout.formula-sine-50",
  "revision": 1,
  "name": "Sine Ribbon 50",
  "category": "generated_advanced",
  "editor": {
    "mode": "parameter_schema",
    "parameters": [
      {
        "id": "count",
        "label": "Fixtures",
        "value_type": "integer",
        "minimum": 1,
        "maximum": 2000,
        "step": 1
      },
      {
        "id": "scale",
        "label": "Scale",
        "value_type": "number",
        "minimum": 0.1,
        "maximum": 20,
        "step": 0.1
      }
    ]
  },
  "geometry": {
    "shape": "formula",
    "formula": {
      "x": "t * 64",
      "y": "sin(t) * 80",
      "t_range": [0, 25],
      "count": 50,
      "scale": 0.4
    },
    "fixture_size": { "width": 8, "height": 8 }
  }
}
