{
  "schema_version": 1,
  "id": "builtin.layout.strip-vertical-tower-120",
  "revision": 1,
  "name": "Vertical Tower Strip 120",
  "category": "basic",
  "editor": { "mode": "form" },
  "geometry": {
    "shape": "strip",
    "count": 120,
    "orientation": "vertical",
    "fixture_size": { "width": 14, "height": 8 },
    "gap": { "x": 6, "y": 6 },
    "pitch": { "x": 20, "y": 14 },
    "origin": { "x": 0, "y": 0 }
  }
}
